<?xml version="1.0" encoding="UTF-8" standalone="yes"?>
<algorithm xmlns="http://www.w3schools.com" xmlns:xsi="http://www.w3.org/2001/XMLSchema-instance" xsi:schemaLocation="http://www.w3schools.com NewXMLSchema.xsd">
    <maxIterations>1024</maxIterations>
    <construction>
        <insertion name="bestInsertion">
            <considerFixedCosts weight="1.0">true</considerFixedCosts>
        </insertion>
    </construction>
    <strategy>
        <memory>3</memory>
        <searchStrategies>
            <searchStrategy name="strategy_1">
                <selector name="selectBest"/>
                <acceptor name="experimentalSchrimpfAcceptance">
                    <alpha>0.0</alpha>
                    <warmup>0</warmup>
                </acceptor>
                <modules>
                    <module name="ruin_and_recreate">
                        <ruin_and_recreate_group>
                            <ruin name="radialRuin">
<share>0.6</share>
                            </ruin>
                            <insertion name="regretInsertion"/>
                        </ruin_and_recreate_group>
                    </module>
                </modules>
                <probability>0.1</probability>
            </searchStrategy>
            <searchStrategy name="strategy_2">
                <selector name="selectBest"/>
                <acceptor name="experimentalSchrimpfAcceptance">
                    <alpha>0.0</alpha>
                    <warmup>0</warmup>
                </acceptor>
                <modules>
                    <module name="ruin_and_recreate">
                        <ruin_and_recreate_group>
                            <ruin name="radialRuin">
<share>0.6</share>
                            </ruin>
                            <insertion name="regretInsertion"/>
                        </ruin_and_recreate_group>
                    </module>
                </modules>
                <probability>0.1</probability>
            </searchStrategy>
            <searchStrategy name="strategy_3">
                <selector name="selectBest"/>
                <acceptor name="experimentalSchrimpfAcceptance">
                    <alpha>0.0</alpha>
                    <warmup>0</warmup>
                </acceptor>
                <modules>
                    <module name="ruin_and_recreate">
                        <ruin_and_recreate_group>
                            <ruin name="radialRuin">
<share>0.6</share>
                            </ruin>
                            <insertion name="regretInsertion"/>
                        </ruin_and_recreate_group>
                    </module>
                </modules>
                <probability>0.1</probability>
            </searchStrategy>
            <searchStrategy name="strategy_4">
                <selector name="selectBest"/>
                <acceptor name="experimentalSchrimpfAcceptance">
                    <alpha>0.0</alpha>
                    <warmup>0</warmup>
                </acceptor>
                <modules>
                    <module name="ruin_and_recreate">
                        <ruin_and_recreate_group>
                            <ruin name="radialRuin">
<share>0.6</share>
                            </ruin>
                            <insertion name="regretInsertion"/>
                        </ruin_and_recreate_group>
                    </module>
                </modules>
                <probability>0.1</probability>
            </searchStrategy>
            <searchStrategy name="strategy_5">
                <selector name="selectBest"/>
                <acceptor name="experimentalSchrimpfAcceptance">
                    <alpha>0.0</alpha>
                    <warmup>0</warmup>
                </acceptor>
                <modules>
                    <module name="ruin_and_recreate">
                        <ruin_and_recreate_group>
                            <ruin name="radialRuin">
<share>0.6</share>
                            </ruin>
                            <insertion name="regretInsertion"/>
                        </ruin_and_recreate_group>
                    </module>
                </modules>
                <probability>0.1</probability>
            </searchStrategy>
            <searchStrategy name="strategy_6">
                <selector name="selectBest"/>
                <acceptor name="experimentalSchrimpfAcceptance">
                    <alpha>0.0</alpha>
                    <warmup>0</warmup>
                </acceptor>
                <modules>
                    <module name="ruin_and_recreate">
                        <ruin_and_recreate_group>
                            <ruin name="radialRuin">
<share>0.6</share>
                            </ruin>
                            <insertion name="regretInsertion"/>
                        </ruin_and_recreate_group>
                    </module>
                </modules>
                <probability>0.1</probability>
            </searchStrategy>
            <searchStrategy name="strategy_7">
                <selector name="selectBest"/>
                <acceptor name="experimentalSchrimpfAcceptance">
                    <alpha>0.0</alpha>
                    <warmup>0</warmup>
                </acceptor>
                <modules>
                    <module name="ruin_and_recreate">
                        <ruin_and_recreate_group>
                            <ruin name="radialRuin">
<share>0.6</share>
                            </ruin>
                            <insertion name="regretInsertion"/>
                        </ruin_and_recreate_group>
                    </module>
                </modules>
                <probability>0.1</probability>
            </searchStrategy>
            <searchStrategy name="strategy_8">
                <selector name="selectBest"/>
                <acceptor name="experimentalSchrimpfAcceptance">
                    <alpha>0.0</alpha>
                    <warmup>0</warmup>
                </acceptor>
                <modules>
                    <module name="ruin_and_recreate">
                        <ruin_and_recreate_group>
                            <ruin name="radialRuin">
<share>0.6</share>
                            </ruin>
                            <insertion name="regretInsertion"/>
                        </ruin_and_recreate_group>
                    </module>
                </modules>
                <probability>0.1</probability>
            </searchStrategy>
            <searchStrategy name="strategy_9">
                <selector name="selectBest"/>
                <acceptor name="experimentalSchrimpfAcceptance">
                    <alpha>0.0</alpha>
                    <warmup>0</warmup>
                </acceptor>
                <modules>
                    <module name="ruin_and_recreate">
                        <ruin_and_recreate_group>
                            <ruin name="radialRuin">
<share>0.6</share>
                            </ruin>
                            <insertion name="regretInsertion"/>
                        </ruin_and_recreate_group>
                    </module>
                </modules>
                <probability>0.1</probability>
            </searchStrategy>
            <searchStrategy name="strategy_10">
                <selector name="selectBest"/>
                <acceptor name="experimentalSchrimpfAcceptance">
                    <alpha>0.0</alpha>
                    <warmup>0</warmup>
                </acceptor>
                <modules>
                    <module name="ruin_and_recreate">
                        <ruin_and_recreate_group>
                            <ruin name="radialRuin">
<share>0.6</share>
                            </ruin>
                            <insertion name="regretInsertion"/>
                        </ruin_and_recreate_group>
                    </module>
                </modules>
                <probability>0.1</probability>
            </searchStrategy>
        </searchStrategies>
    </strategy>
</algorithm>
